{
  "schemaVersion": "1.0",
  "id": "run_01M4XP0YTD43EJQH0GBV58JRZW",
  "executionId": "mission-7/verify-1",
  "taskId": "QA-142",
  "harness": {
    "name": "qa-regression",
    "version": "1.0.0",
    "lockDigest": "sha256:ea5f1a7cc594b10ea00c6ffa4a1649a2c1db009b4e2941a5ff65a4279e8ad79d"
  },
  "harnesses": [
    {
      "name": "qa-regression",
      "version": "1.0.0",
      "digest": "sha256:c17b2ffc5fb4ba1fea6717c08ef29b828f1f817e86fe6fdcf0cb86d11293bb84"
    }
  ],
  "repository": {
    "commitSha": "unversioned",
    "workspaceId": "wt-qa-142"
  },
  "startedAt": "2026-10-14T17:05:41.178Z",
  "completedAt": "2026-10-14T17:05:41.205Z",
  "verdict": "passed",
  "reasons": [],
  "checks": [
    {
      "id": "test",
      "required": true,
      "command": ["pnpm", "test", "--run"],
      "cwd": ".",
      "from": ["qa-regression@1.0.0"],
      "durationMs": 0,
      "state": "passed",
      "exitCode": 0,
      "signal": null,
      "startedAt": "2026-10-14T17:05:41.201Z",
      "completedAt": "2026-10-14T17:05:41.201Z",
      "outputBytes": 16,
      "truncated": false,
      "secretFindings": 0,
      "log": "logs/test.log"
    },
    {
      "id": "integration",
      "required": false,
      "command": ["pnpm", "run", "test:integration"],
      "cwd": ".",
      "from": ["qa-regression@1.0.0"],
      "durationMs": 0,
      "state": "skipped",
      "reason": "missing_script",
      "message": "when.scriptExists: package.json has no 'test:integration' script"
    },
    {
      "id": "e2e",
      "required": false,
      "command": ["pnpm", "run", "test:e2e"],
      "cwd": ".",
      "from": ["qa-regression@1.0.0"],
      "durationMs": 0,
      "state": "failed",
      "exitCode": 1,
      "signal": null,
      "startedAt": "2026-10-14T17:05:41.204Z",
      "completedAt": "2026-10-14T17:05:41.204Z",
      "outputBytes": 9,
      "truncated": false,
      "secretFindings": 0,
      "log": "logs/e2e.log"
    },
    {
      "id": "coverage",
      "required": false,
      "command": ["pnpm", "run", "coverage"],
      "cwd": ".",
      "from": ["qa-regression@1.0.0"],
      "durationMs": 0,
      "state": "skipped",
      "reason": "missing_script",
      "message": "when.scriptExists: package.json has no 'coverage' script"
    }
  ],
  "policyDecisions": [
    {
      "policy": "command",
      "stage": "before",
      "outcome": "allow",
      "layer": "system",
      "checkId": "test",
      "message": "check 'test' permitted: pnpm test --run"
    },
    {
      "policy": "command",
      "stage": "before",
      "outcome": "allow",
      "layer": "system",
      "checkId": "integration",
      "message": "check 'integration' permitted: pnpm run test:integration"
    },
    {
      "policy": "command",
      "stage": "before",
      "outcome": "allow",
      "layer": "system",
      "checkId": "e2e",
      "message": "check 'e2e' permitted: pnpm run test:e2e"
    },
    {
      "policy": "command",
      "stage": "before",
      "outcome": "allow",
      "layer": "system",
      "checkId": "coverage",
      "message": "check 'coverage' permitted: pnpm run coverage"
    },
    {
      "policy": "network",
      "stage": "runtime",
      "outcome": "deny",
      "layer": "harness",
      "message": "network denied: proxy variables point at an unreachable loopback (best effort, not an OS sandbox)"
    }
  ],
  "exceptions": [],
  "evidence": [
    {
      "path": "logs/e2e.log",
      "sha256": "sha256:687a0b68092fc02dcbdb066d5caeedfa22088209f6cc6d2c752eee5df49409cc",
      "bytes": 9,
      "producedBy": "e2e",
      "kind": "log"
    },
    {
      "path": "logs/test.log",
      "sha256": "sha256:b934062b56c56bfe03b08414b7221d4b8f60ebd9ea95ad6029ae8409c1a81025",
      "bytes": 16,
      "producedBy": "test",
      "kind": "log"
    }
  ],
  "summary": {
    "passed": 1,
    "failed": 1,
    "skipped": 2,
    "errored": 0
  },
  "environment": {
    "brokkrVersion": "0.1.0",
    "node": "v25.9.0",
    "platform": "darwin",
    "arch": "arm64"
  },
  "warnings": [
    "/var/folders/hm/t3x0_d6j6ms83phrm9n7s0f00000gn/T/fix-glcTnu is not a git repository; the verified tree state is not recorded"
  ]
}
